<?xml version="1.0" encoding="UTF-8"?>
<!DOCTYPE network SYSTEM "http://www.matsim.org/files/dtd/network_v2.dtd">
<network name="test network">

	<attributes>
		<attribute name="coordinateReferenceSystem" class="java.lang.String">Atlantis</attribute>
	</attributes>

	<!--
										cd              dg        gj              jk
								   //==============>(D)===>(G)=============>(J)===========>(K)
								  //                     //
		  ab          bc         //    ce               // eg
	  (A)======>(B)==========>(C)====================>(E)
								\\                      \\ eh
								 \\    cf            fh  \\       hl              lm
								  \\=============>(F)===>(H)===============>(L)===========>(M)



		Links:
		- AB, BC, GJ, JK, HL, LM: railsimTrainCapacity = 2 (mesoscopic tracks)
		- CD, CE, CF, DG, EG, EH, FH: railsimTrainCapacity = 1 (microscopic station)
		- BC: railsimEntry=true
		- GJ, HL: railsimExit=true

		Transit Stop Facilities (and Areas, if set)
		- Stop AB
		- Stop CD (CDEF)
		- Stop CE (CDEF)
		- Stop CF (CDEF)
		- Stop JK (JK)
		- Stop LM

		Trains:
		- Train1: AB - CE - JK
		- Train2: AB - CE - JK
		- Train3: AB - CE - JK
		- Train4: AB - CE - LM
		- Train5: AB - CE - LM

	-->

	<nodes>
		<node id="A" x="0" y="0"/>
		<node id="B" x="400" y="0"/>
		<node id="C" x="5400" y="0"/>
		<node id="D" x="5800" y="50"/>
		<node id="E" x="5800" y="0"/>
		<node id="F" x="5800" y="-50"/>
		<node id="G" x="6000" y="50"/>
		<node id="H" x="6000" y="-50"/>
		<node id="J" x="9000" y="50"/>
		<node id="K" x="9400" y="50"/>
		<node id="L" x="9000" y="-50"/>
		<node id="M" x="9400" y="-50"/>
	</nodes>


	<links capperiod="01:00:00">

		<link id="ab" from="A" to="B" length="400" freespeed="5" capacity="3600.0" permlanes="1" modes="rail">
			<attributes>
				<attribute name="railsimTrainCapacity" class="java.lang.Integer">3</attribute>
			</attributes>
		</link>
		<link id="bc" from="B" to="C" length="5000" freespeed="25" capacity="3600.0" permlanes="1" modes="rail">
			<attributes>
				<attribute name="railsimTrainCapacity" class="java.lang.Integer">3</attribute>
				<attribute name="railsimEntry" class="java.lang.Boolean">true</attribute>
			</attributes>
		</link>

		<link id="cd" from="C" to="D" length="400" freespeed="5" capacity="3600.0" permlanes="1" modes="rail"/>
		<link id="ce" from="C" to="E" length="400" freespeed="5" capacity="3600.0" permlanes="1" modes="rail"/>
		<link id="cf" from="C" to="F" length="400" freespeed="5" capacity="3600.0" permlanes="1" modes="rail"/>
		<link id="dg" from="D" to="G" length="200" freespeed="5" capacity="3600.0" permlanes="1" modes="rail"/>
		<link id="eg" from="E" to="G" length="200" freespeed="5" capacity="3600.0" permlanes="1" modes="rail"/>
		<link id="eh" from="E" to="H" length="200" freespeed="5" capacity="3600.0" permlanes="1" modes="rail"/>
		<link id="fh" from="F" to="H" length="200" freespeed="5" capacity="3600.0" permlanes="1" modes="rail"/>

		<link id="gj" from="G" to="J" length="3000" freespeed="25" capacity="3600.0" permlanes="1" modes="rail">
			<attributes>
				<attribute name="railsimTrainCapacity" class="java.lang.Integer">3</attribute>
				<attribute name="railsimExit" class="java.lang.Boolean">true</attribute>
			</attributes>
		</link>
		<link id="jk" from="J" to="K" length="400" freespeed="25" capacity="3600.0" permlanes="1" modes="rail">
			<attributes>
				<attribute name="railsimTrainCapacity" class="java.lang.Integer">3</attribute>
			</attributes>
		</link>

		<link id="hl" from="H" to="L" length="3000" freespeed="25" capacity="3600.0" permlanes="1" modes="rail">
			<attributes>
				<attribute name="railsimTrainCapacity" class="java.lang.Integer">3</attribute>
				<attribute name="railsimExit" class="java.lang.Boolean">true</attribute>
			</attributes>
		</link>
		<link id="lm" from="L" to="M" length="400" freespeed="25" capacity="3600.0" permlanes="1" modes="rail">
			<attributes>
				<attribute name="railsimTrainCapacity" class="java.lang.Integer">3</attribute>
			</attributes>
		</link>

	</links>

</network>
