<?xml version="1.0" encoding="UTF-8"?>
<!DOCTYPE network SYSTEM "http://www.matsim.org/files/dtd/network_v2.dtd">
<network>

	<attributes>
		<attribute name="coordinateReferenceSystem" class="java.lang.String" >Atlantis</attribute>
	</attributes>
<!-- ====================================================================== -->

	<nodes>
		<node id="node1" x="0.0" y="0.0" >
		</node>
		<node id="node2" x="200.0" y="0.0" >
		</node>
		<node id="node3" x="600.0" y="0.0" >
		</node>
		<node id="node4" x="0.0" y="200.0" >
		</node>
		<node id="node5" x="200.0" y="200.0" >
		</node>
		<node id="node6" x="600.0" y="200.0" >
		</node>
		<node id="node7" x="0.0" y="400.0" >
		</node>
		<node id="node8" x="200.0" y="400.0" >
		</node>
		<node id="node9" x="600.0" y="400.0" >
		</node>
	</nodes>

<!-- ====================================================================== -->

	<links capperiod="16:00:00">
		<link id="link12" from="node1" to="node2" length="200.0" freespeed="9.722222222222221" capacity="8400.0" permlanes="1.0" oneway="1" modes="car" >
			<attributes>
				<attribute name="hbefa_road_type" class="java.lang.String" >URB/Local/50</attribute>
			</attributes>
		</link>
		<link id="link14" from="node1" to="node4" length="200.0" freespeed="9.722222222222221" capacity="8400.0" permlanes="1.0" oneway="1" modes="car" >
			<attributes>
				<attribute name="hbefa_road_type" class="java.lang.String" >URB/Local/50</attribute>
			</attributes>
		</link>
		<link id="link21" from="node2" to="node1" length="200.0" freespeed="8.333333333333334" capacity="11200.0" permlanes="1.0" oneway="1" modes="car" >
			<attributes>
				<attribute name="hbefa_road_type" class="java.lang.String" >URB/Local/50</attribute>
			</attributes>
		</link>
		<link id="link23" from="node2" to="node3" length="400.0" freespeed="23.593687145089014" capacity="14000.0" permlanes="1.0" oneway="1" modes="car" >
			<attributes>
				<attribute name="hbefa_road_type" class="java.lang.String" >URB/Local/50</attribute>
			</attributes>
		</link>
		<link id="link25" from="node2" to="node5" length="200.0" freespeed="19.444444444444443" capacity="40600.0" permlanes="2.0" oneway="1" modes="car" >
			<attributes>
				<attribute name="hbefa_road_type" class="java.lang.String" >URB/Local/50</attribute>
			</attributes>
		</link>
		<link id="link32" from="node3" to="node2" length="400.0" freespeed="17.80237909177737" capacity="9600.0" permlanes="1.0" oneway="1" modes="car" >
			<attributes>
				<attribute name="hbefa_road_type" class="java.lang.String" >URB/Local/50</attribute>
			</attributes>
		</link>
		<link id="link36" from="node3" to="node6" length="200.0" freespeed="13.888888888888891" capacity="46200.0" permlanes="3.0" oneway="1" modes="car" >
			<attributes>
				<attribute name="hbefa_road_type" class="java.lang.String" >URB/Local/50</attribute>
			</attributes>
		</link>
		<link id="link41" from="node4" to="node1" length="200.0" freespeed="13.88888888888889" capacity="14000.0" permlanes="1.0" oneway="1" modes="car" >
			<attributes>
				<attribute name="hbefa_road_type" class="java.lang.String" >URB/Local/50</attribute>
			</attributes>
		</link>
		<link id="link45" from="node4" to="node5" length="200.0" freespeed="13.88888888888889" capacity="15400.0" permlanes="1.0" oneway="1" modes="car" >
			<attributes>
				<attribute name="hbefa_road_type" class="java.lang.String" >URB/Local/50</attribute>
			</attributes>
		</link>
		<link id="link47" from="node4" to="node7" length="200.0" freespeed="13.888888888888888" capacity="15400.0" permlanes="1.0" oneway="1" modes="car" >
			<attributes>
				<attribute name="hbefa_road_type" class="java.lang.String" >URB/Local/50</attribute>
			</attributes>
		</link>
		<link id="link52" from="node5" to="node2" length="200.0" freespeed="13.88888888888889" capacity="46200.0" permlanes="3.0" oneway="1" modes="car" >
			<attributes>
				<attribute name="hbefa_road_type" class="java.lang.String" >URB/Local/50</attribute>
			</attributes>
		</link>
		<link id="link54" from="node5" to="node4" length="200.0" freespeed="16.666666666666668" capacity="12000.0" permlanes="1.0" oneway="1" modes="car" >
			<attributes>
				<attribute name="hbefa_road_type" class="java.lang.String" >URB/Local/50</attribute>
			</attributes>
		</link>
		<link id="link56" from="node5" to="node6" length="400.0" freespeed="19.444444444444443" capacity="19600.0" permlanes="1.0" oneway="1" modes="car" >
			<attributes>
				<attribute name="hbefa_road_type" class="java.lang.String" >URB/Local/50</attribute>
			</attributes>
		</link>
		<link id="link58" from="node5" to="node8" length="200.0" freespeed="19.444444444444443" capacity="13200.0" permlanes="1.0" oneway="1" modes="car" >
			<attributes>
				<attribute name="hbefa_road_type" class="java.lang.String" >URB/Local/50</attribute>
			</attributes>
		</link>
		<link id="link63" from="node6" to="node3" length="200.0" freespeed="13.88888888888889" capacity="46200.0" permlanes="3.0" oneway="1" modes="car" >
			<attributes>
				<attribute name="hbefa_road_type" class="java.lang.String" >URB/Local/50</attribute>
			</attributes>
		</link>
		<link id="link65" from="node6" to="node5" length="400.0" freespeed="18.488361233685882" capacity="13200.0" permlanes="1.0" oneway="1" modes="car" >
			<attributes>
				<attribute name="hbefa_road_type" class="java.lang.String" >URB/Local/50</attribute>
			</attributes>
		</link>
		<link id="link69" from="node6" to="node9" length="200.0" freespeed="15.333471431790263" capacity="10800.0" permlanes="1.0" oneway="1" modes="car" >
			<attributes>
				<attribute name="hbefa_road_type" class="java.lang.String" >URB/Local/50</attribute>
			</attributes>
		</link>
		<link id="link74" from="node7" to="node4" length="200.0" freespeed="16.666666666666668" capacity="12000.0" permlanes="1.0" oneway="1" modes="car" >
			<attributes>
				<attribute name="hbefa_road_type" class="java.lang.String" >URB/Local/50</attribute>
			</attributes>
		</link>
		<link id="link78" from="node7" to="node8" length="200.0" freespeed="17.796610169491526" capacity="12000.0" permlanes="1.0" oneway="1" modes="car" >
			<attributes>
				<attribute name="hbefa_road_type" class="java.lang.String" >URB/Local/50</attribute>
			</attributes>
		</link>
		<link id="link85" from="node8" to="node5" length="200.0" freespeed="19.27437641723356" capacity="14400.0" permlanes="1.0" oneway="1" modes="car" >
			<attributes>
				<attribute name="hbefa_road_type" class="java.lang.String" >URB/Local/50</attribute>
			</attributes>
		</link>
		<link id="link87" from="node8" to="node7" length="200.0" freespeed="18.023824633772275" capacity="10800.0" permlanes="1.0" oneway="1" modes="car" >
			<attributes>
				<attribute name="hbefa_road_type" class="java.lang.String" >URB/Local/50</attribute>
			</attributes>
		</link>
		<link id="link89" from="node8" to="node9" length="400.0" freespeed="19.444444444444443" capacity="13200.0" permlanes="1.0" oneway="1" modes="car" >
			<attributes>
				<attribute name="hbefa_road_type" class="java.lang.String" >URB/Local/50</attribute>
			</attributes>
		</link>
		<link id="link96" from="node9" to="node6" length="200.0" freespeed="14.543234024057222" capacity="10800.0" permlanes="1.0" oneway="1" modes="car" >
			<attributes>
				<attribute name="hbefa_road_type" class="java.lang.String" >URB/Local/50</attribute>
			</attributes>
		</link>
		<link id="link98" from="node9" to="node8" length="400.0" freespeed="19.444444444444443" capacity="13200.0" permlanes="1.0" oneway="1" modes="car" >
			<attributes>
				<attribute name="hbefa_road_type" class="java.lang.String" >URB/Local/50</attribute>
			</attributes>
		</link>
	</links>

<!-- ====================================================================== -->

</network>
